{
  "$schema": "https://json-schema.org/draft/2020-12/schema",
  "$id": "https://ps26145.local/schemas/alert.schema.json",
  "title": "Alert / Incident v1.3",
  "description": "Frozen alert contract. THIS FILE is the source of truth for required fields, types, enum values, evidence structure, observability state, detector metadata, incident identity and chain fields - not any prose document. Contract tests fail on schema drift. Source: FINAL_DEVELOPMENT_PLAN_V6.3.md sections 6.3, 6.3.1, 7B, 13, 19.1.",
  "type": "object",
  "additionalProperties": false,

  "required": [
    "schema_version",
    "timestamp",
    "flow_id",
    "flow_ref_type",
    "ps_class",
    "threat_class",
    "detector",
    "confidence",
    "score_type",
    "calibrated",
    "evidence",
    "incident_id",
    "capability",
    "calibrated_on"
  ],

  "properties": {
    "schema_version": { "const": "1.3" },

    "timestamp": {
      "type": "string",
      "format": "date-time",
      "description": "PS constraint-(e) mandatory field. Required ISO-8601 display/alert time."
    },
    "observed_time": {
      "type": "string",
      "format": "date-time",
      "description": "Original observation time, preserved separately from the replay-rebased display time."
    },

    "flow_id": {
      "type": "string",
      "pattern": "^[0-9a-f]{16}$",
      "description": "PS constraint-(e) mandatory field. NEVER NULL. sha256(canonical_value).hexdigest()[:16] - exactly 16 lowercase hex chars, a 64-bit truncated SHA-256, NOT 16 bytes (Phase 0 decision DOC-006). For a spoofed flood there is no honest single source flow, so flow_ref_type is 'aggregate' and the canonical dedup identity is hashed."
    },
    "flow_ref_type": {
      "type": "string",
      "enum": ["flow_5tuple", "aggregate", "entity"],
      "description": "flow_5tuple - one concrete flow is observable. aggregate - DDoS/reflection or another multi-flow event. entity - DGA, scan or similar behaviour best represented by a source/entity identity."
    },
    "contributing_flow_ids": {
      "type": "array",
      "maxItems": 32,
      "items": { "type": "string", "pattern": "^[0-9a-f]{16}$" },
      "description": "Optional bounded SAMPLE of underlying flows. Evidence only - never replaces the mandatory flow_id."
    },

    "ps_class": {
      "type": "string",
      "enum": [
        "Volumetric DDoS / flooding",
        "Port scanning / reconnaissance",
        "Botnet C2 beaconing",
        "DGA / DNS tunnelling",
        "Malware in encrypted sessions",
        "Data exfiltration"
      ],
      "description": "PS constraint-(e) mandatory field. The six PS26145 classes, frozen external wording, verbatim. External material uses these strings only."
    },
    "threat_class": {
      "type": "string",
      "description": "PS constraint-(e) mandatory field. The concrete internal detector label. Remains internal terminology."
    },
    "detector": {
      "type": "string",
      "enum": ["ddos", "reflection", "scan", "dns", "dga", "c2", "tls_quic", "exfil"],
      "description": "The eight internal detector modules. Six classes, eight modules - a contract test asserts every detector maps to exactly one ps_class. Slowloris is a path inside 'ddos', not a ninth module."
    },

    "confidence": {
      "type": "number",
      "minimum": 0,
      "maximum": 1,
      "description": "PS constraint-(e) mandatory field. ALWAYS a number in [0,1], never null (alerts/confidence.py). How it was obtained is stated in calibrated_on; the raw detector score stays in score / score_type."
    },
    "calibrated_on": {
      "type": "string",
      "enum": ["synthetic_replay", "platt_dga", "uncalibrated"],
      "description": "Source of confidence. synthetic_replay = per-detector logistic fit on the labelled synthetic replay; platt_dga = Platt-calibrated LightGBM DGA probability; uncalibrated = documented bounded mapping of the raw score, NOT a probability. calibrated is true only for the first two."
    },
    "score": {
      "type": ["number", "null"],
      "description": "Raw detector score, kept separate from the PS-required confidence field."
    },
    "score_type": {
      "type": "string",
      "enum": ["robust_z", "anomaly_score", "model_probability", "rule_score"],
      "description": "robust_z and rule_score are NEVER probabilities. Only model_probability may be calibrated."
    },
    "calibrated": {
      "type": "boolean",
      "description": "The UI appends a percent sign ONLY when this is true. A robust z-score or rule score is never presented as a probability."
    },

    "evidence": {
      "type": "object",
      "minProperties": 1,
      "additionalProperties": true,
      "description": "PS constraint-(e) mandatory field. Actual observed feature values and their interpretation. Each detector must satisfy its minimum-evidence contract (design.md section 12).",
      "properties": {
        "interpretation": { "type": "string" },
        "qtype_distribution": {
          "type": "object",
          "additionalProperties": true,
          "description": "DNS tunnel: TXT/NULL/CNAME and other shares. A PS-named discriminator - must be exposed in the evidence drawer."
        },
        "ja3": { "type": ["string", "null"] },
        "ja3s": { "type": ["string", "null"] },
        "ja4": { "type": ["string", "null"] },
        "packet_size_first_n": { "type": ["array", "null"], "items": { "type": "integer" } },
        "direction_first_n": { "type": ["array", "null"], "items": { "type": "string" } },
        "iat_median": { "type": ["number", "null"] },
        "iat_p95": { "type": ["number", "null"] },
        "iat_cv": { "type": ["number", "null"] },
        "half_open_concurrency": { "type": ["integer", "null"], "description": "Slowloris." },
        "connection_duration_p95": { "type": ["number", "null"], "description": "Slowloris." },
        "bytes_per_connection": { "type": ["number", "null"], "description": "Slowloris." },
        "reserved_source_share": {
          "type": ["number", "null"],
          "description": "Reflection. Computed against EXTERNAL address space only, with declared lab prefixes excluded from the bogon set. The exclusion is stated in the drawer text."
        }
      }
    },

    "baseline": {
      "type": ["object", "null"],
      "additionalProperties": true,
      "description": "What the observation was compared against."
    },
    "threshold": {
      "type": ["object", "null"],
      "additionalProperties": true,
      "description": "The detector threshold in force, from config/thresholds.yaml."
    },
    "window": {
      "type": ["object", "null"],
      "additionalProperties": false,
      "properties": {
        "start": { "type": "string", "format": "date-time" },
        "end": { "type": "string", "format": "date-time" },
        "duration_s": { "type": "number" }
      }
    },

    "incident_id": {
      "type": "string",
      "pattern": "^[0-9a-f]{16}$",
      "description": "sha256(canonical(dedup_key)).hexdigest()[:16]. Stable across restarts. Same 16-hex-character form as flow_id."
    },
    "dedup_key": {
      "type": ["string", "null"],
      "description": "Canonical serialized deduplication key. Unavailable components carry the exact sentinel string NOT_OBSERVABLE - never null, empty string, zero or 'unknown' (Phase 0 decision DOC-007)."
    },
    "status": {
      "type": "string",
      "enum": ["NEW", "ACTIVE", "UPDATED", "RESOLVED"]
    },
    "severity": {
      "type": "string",
      "enum": ["INFO", "LOW", "MEDIUM", "HIGH", "CRITICAL"]
    },
    "first_observed": { "type": ["string", "null"], "format": "date-time" },
    "last_observed": { "type": ["string", "null"], "format": "date-time" },
    "event_count": { "type": ["integer", "null"], "minimum": 0 },

    "capability": {
      "type": "object",
      "additionalProperties": false,
      "required": ["detector_state", "input_mode"],
      "description": "Evidence-visibility axis. Missing evidence is NEVER converted into a benign result; the alert records the visibility limitation.",
      "properties": {
        "detector_state": {
          "type": "string",
          "enum": ["OBSERVABLE", "DEGRADED", "NOT_OBSERVABLE"]
        },
        "input_mode": {
          "type": "string",
          "enum": ["pcap_replay", "live_tap", "ipfix", "netflow_v9", "sflow"]
        },
        "missing_evidence": {
          "type": "array",
          "items": { "type": "string" },
          "description": "Named evidence fields that were not observable for this alert."
        },
        "sampled": { "type": ["boolean", "null"] },
        "sampling_rate": { "type": ["integer", "null"], "minimum": 1 }
      }
    },

    "sensor": {
      "type": ["object", "null"],
      "additionalProperties": false,
      "properties": {
        "suricata_version": { "type": ["string", "null"], "description": "Pinned 7.0.3 or later for JA4. Recorded in every alert." },
        "kernel_drops": { "type": ["integer", "null"], "minimum": 0 },
        "sensor_drop_pct": { "type": ["number", "null"], "minimum": 0 },
        "is_lower_bound": { "type": ["boolean", "null"] }
      }
    },

    "model_version": {
      "type": ["string", "null"],
      "description": "For the DGA rule fallback this is 'rules-fallback' with calibrated=false. No Brier score or reliability diagram is published for the fallback."
    },
    "intel_version": { "type": ["string", "null"] },

    "latency_ms": {
      "type": ["number", "null"],
      "minimum": 0,
      "description": "MEASURED with time.perf_counter_ns, never estimated: triggering event entering detectors/pipeline.py to the alert leaving it; re-measured by api/state.py up to hash-chain signing. Always set on pipeline-emitted alerts. WebSocket push adds at most the 250 ms batch interval. SLO p95 below 2000 ms."
    },

    "recommendation": {
      "type": ["string", "null"],
      "description": "ADVISORY TEXT ONLY. There is no mitigation button, command, API call or return path anywhere in the system."
    },

    "seq": {
      "type": ["integer", "null"],
      "minimum": 0,
      "description": "Monotonic across the whole store, not per incident."
    },
    "prev_hash": {
      "type": ["string", "null"],
      "pattern": "^[0-9a-f]{64}$",
      "description": "FULL 64-character SHA-256 digest - never truncated. Genesis is 64 zeros. The 16-char truncation applies only to flow_id and incident_id."
    },
    "entry_hash": {
      "type": ["string", "null"],
      "pattern": "^[0-9a-f]{64}$",
      "description": "sha256(prev_hash || seq || incident_id || last_updated || payload_hash). Concatenation defined ONCE in alerts/hash_chain.py and imported by the verifier."
    },
    "payload_hash": {
      "type": ["string", "null"],
      "pattern": "^[0-9a-f]{64}$",
      "description": "sha256(canonical(incident_payload)). Canonical form: JSON, keys sorted, no whitespace, UTF-8, NaN/Inf rejected."
    }
  }
}
